Review,Cleaned_Review,Tokens,Emotion
"Pretty awesome movie.  It shows what one crazy person can convince other crazy people to do.  Everyone needs something to believe in.  I recommend Jesus Christ, but they want Tyler Durden.","pretty awesome movie  it shows what one crazy person can convince other crazy people to do  everyone needs something to believe in.  i recommend jesus christ, but they want tyler durden.","['pretty', 'awesome', 'movie', ' ', 'show', 'one', 'crazy', 'person', 'convince', 'crazy', 'people', ' ', 'everyone', 'need', 'something', 'believe', '.', ' ', 'recommend', 'jesus', 'christ', ',', 'want', 'tyler', 'durden', '.']",
In my top 5 of all time favourite movies. Great story line and a movie you can watch over and over again.,in my top  of all time favourite movies great story line and a movie you can watch over and over again.,"['top', ' ', 'time', 'favourite', 'movie', 'great', 'story', 'line', 'movie', 'watch', '.']",
