Review,Cleaned_Review,Tokens,Emotion
"If you enjoy reading my Spoiler-Free reviews, please follow my blog @
https://www.msbreviews.com

David Fincher’s new film, Mank, is coming soon on Netflix, released six years after his latest installment, Gone Girl. Therefore, this week I’m reviewing five of Fincher’s movies. Se7en was the first one, and now it’s time for one of the most culturally impactful films of the 90s, Fight Club. This is another rewatch of another filmmaking classic, one that I was never able to absolutely adore like most people. When this movie came out in 1999, critics were extremely divided, and the film failed at the box office. With time, it gained a cult following through home media, but it’s still considered a very controversial piece of cinema. So, nothing new, having in mind Fincher is at the helm.

Despite this being my third or fourth time experiencing this story, I never really changed my opinion about it, which is a bit uncommon in my viewing history. Usually, after multiple rewatches, my overall thoughts about a movie slightly vary, but Fight Club is one of the few exceptions. I believe my opinion remains intact from the very first watch. I really enjoy this film, but I can’t state that I absolutely love it. Since this is a special case, I’m going to start with what still bothers me after so many viewings, something I also rarely do in my reviews since I always leave the bad stuff to the end of the article.

Without spoiling anything, of course, there’s a vital plot twist that comes later in the movie that I could only appreciate by its execution, but never by its impact on the narrative. Jim Uhls’ screenplay relies on the main characters’ friendship to carry the story forward, and throughout the first two acts, Fincher leaves not-that-subtle hints to a massive revelation, which eventually triggers the beginning of the third act. This major plot point is brilliantly executed, and I still feel incredibly fascinated by its delivery, both in terms of the dialogue and the performances. However, its impact on any lightly focused, observant viewer is close to zero due to the clear evidence that pointed towards this development.

Now, I don’t want to sound like that stereotypical moviegoer that says, “I guessed the twist before its revelation, hence it all sucks”. Like I insinuate above, I was still wholly captivated during the entirety of the third act. Nevertheless, Fight Club’s runtime is far from being short, and Fincher spends a lot of time building up an idea that loses its surprise factor even before the film’s midpoint. It changes the protagonist’s perspective, it takes the viewer through a predictable yet entertaining path, setting up a powerful, meaningful ending. However, personally, I don’t feel like the time spent in the first two acts was satisfyingly compensated in the end… at least, not in its entirety.

The second act also has a short period where it loses a bit of steam due to some repetitive sequences and an unnecessary amount of flashbacks. Again, I feel like Fincher didn’t completely trust the audience back then, contrary to his procedure in Se7en. In the latter flick, Fincher left the biggest responsibility to the viewer’s imagination, leaving the murder scenes for the audience to picture in their minds. In Fight Club, that ambiguity and implicit dialogue are still present, sure, but even before the third act, there’s already an attempt to explain too much certain portions of the narrative that I wish would stay vaguer.

Without spoiling anything, of course, there’s a vital plot twist that comes later in the movie that I could only appreciate by its execution, but never by its impact on the narrative. Jim Uhls’ screenplay relies on the main characters’ friendship to carry the story forward, and throughout the first two acts, Fincher leaves not-that-subtle hints to a massive revelation, which eventually triggers the beginning of the third act. This major plot point is brilliantly executed, and I still feel incredibly fascinated by its delivery, both in terms of the dialogue and the performances. However, its impact on any lightly focused, observant viewer is close to zero due to the clear evidence that pointed towards this development.

Now, I don’t want to sound like that stereotypical moviegoer that says, “I guessed the twist before its revelation, hence it all sucks”. Like I insinuate above, I was still wholly captivated during the entirety of the third act. Nevertheless, Fight Club’s runtime is far from being short, and Fincher spends a lot of time building up an idea that loses its surprise factor even before the film’s midpoint. It changes the protagonist’s perspective, it takes the viewer through a predictable yet entertaining path, setting up a powerful, meaningful ending. However, personally, I don’t feel like the time spent in the first two acts was satisfyingly compensated in the end… at least, not in its entirety.

The second act also has a short period where it loses a bit of steam due to some repetitive sequences and an unnecessary amount of flashbacks. Again, I feel like Fincher didn’t completely trust the audience back then, contrary to his procedure in Se7en. In the latter flick, Fincher left the biggest responsibility to the viewer’s imagination, leaving the murder scenes for the audience to picture in their minds. In Fight Club, that ambiguity and implicit dialogue are still present, sure, but even before the third act, there’s already an attempt to explain too much certain portions of the narrative that I wish would stay vaguer.

Don’t worry, I’m done with the negatives, and don’t forget: I really, really like this movie. Obviously, Fincher and Uhls created a story packed with underlying themes and social commentary. From the whole consumerism theory to the more psychological component regarding Edward Norton’s mental state, every message is seamlessly communicated to the audience. I’ve also been through a point in my life where I wish I’d be someone else, someone who had already achieved every dream of mine successfully with an overwhelming feeling of fulfillment. Coping with the inability to become that perfect someone can become an excruciating, sad, depressing process, and it varies drastically from person to person.

Fight Club approaches mental health and people’s acceptance of who they truly are in a groundbreaking manner, capturing Edward Norton’s emotions perfectly and broadcasting his thoughts through some of the best narration in the history of cinema. Its take on the world of consumerism is undoubtedly interesting and plays a big part in the climax of the film. Despite the issues described above, Uhls’ screenplay is very well-written, elevating the conversations between Norton and Brad Pitt (Ad Astra, Once Upon a Time in Hollywood), which are indeed remarkably entertaining. Predictable or not, the main story is wonderfully executed by Fincher, who continues to demonstrate his impressive technical attributes.

Once again, the pre-production phase is proved here to be as important as any other stage in the filmmaking process. Fincher’s dedication to his features is palpable and visible on-screen through every single technical aspect. This time, Fincher brought in Jeff Cronenweth as the director of photography, and both worked together to not only create that desaturated, realistic atmosphere that Fincher loves so much but also to deliver the brutal, violent, bloody fight scenes that keep the entertainment levels at their highest. With clean, consistent, coherent editing from James Haygood, the movie flows beautifully despite its lengthy runtime. The Dust Brothers’ score is quite alternative, which suits the also unconventional storytelling.

Last but not least, Edward Norton and Brad Pitt. I know it’s incredibly cliche to write that two actors share impeccable chemistry, but Norton and Pitt take it to a whole other level. In two physically-demanding displays, both actors deliver award-worthy performances that marked their careers. Pitt offers one of his most underrated portrayals, being extremely funny throughout the entire film, but also astonishingly badass, carrying his fight sequences as amazing as he does with his dialogues. On the other hand, seeing Norton go all-out is a terrific experience. I lack words to describe such an emotionally compelling interpretation, filled with powerful character moments. A final word of praise to Helena Bonham Carter (Enola Holmes), who also delivers an exceptional performance.

In the end, Fight Club is and will probably remain David Fincher’s most controversial movie for a long, long time. With an absolutely brilliant direction and execution, Fincher uses Jim Uhls’ captivating, layered, unconventional screenplay to tackle themes such as consumerism, society’s behavior, and mental health, seamlessly transmitting meaningful yet contentious messages. Once again, the filmmaking in display is technically flawless, going from the trademark authentic cinematography and production design to the unique score, all flowing superbly through excellent editing. Unfortunately, I don’t belong to the group of people who utterly love this film. The excessive (sometimes unnecessary) use of flashbacks doesn’t help, but it’s the enormous build-up packed with overly explicit clues to a significant (yet unsurprising) plot twist that ends up partially ruining the viewing for me. I also wish that the script developed a few plot points more ambiguously, but Brad Pitt and Edward Norton elevate the whole movie so much with their ridiculously outstanding performances that these small issues don’t keep me away from highly recommending one of the most memorable, iconic films of all-time.

Rating: A-","if you enjoy reading my spoilerfree reviews please follow my blog @
https://www.msbreviews.com

david fincher’s new film, mank, is coming soon on netflix, released six years after his latest installment, gone girl. therefore, this week i’m reviewing five of fincher’s movies. se7en was the first one, and now it’s time for one of the most culturally impactful films of the 90s, fight club. this is another rewatch of another filmmaking classic, one that i was never able to absolutely adore like most people. when this movie came out in 1999, critics were extremely divided, and the film failed at the box office. with time, it gained a cult following through home media, but it’s still considered a very controversial piece of cinema. so, nothing new, having in mind fincher is at the helm.

despite this being my third or fourth time experiencing this story, i never really changed my opinion about it, which is a bit uncommon in my viewing history. usually, after multiple rewatches, my overall thoughts about a movie slightly vary, but fight club is one of the few exceptions. i believe my opinion remains intact from the very first watch. i really enjoy this film, but i can’t state that i absolutely love it. since this is a special case, i’m going to start with what still bothers me after so many viewings, something i also rarely do in my reviews since i always leave the bad stuff to the end of the article.

without spoiling anything, of course, there’s a vital plot twist that comes later in the movie that i could only appreciate by its execution, but never by its impact on the narrative. jim uhls’ screenplay relies on the main characters’ friendship to carry the story forward, and throughout the first two acts, fincher leaves not-that-subtle hints to a massive revelation, which eventually triggers the beginning of the third act. this major plot point is brilliantly executed, and i still feel incredibly fascinated by its delivery, both in terms of the dialogue and the performances. however, its impact on any lightly focused, observant viewer is close to zero due to the clear evidence that pointed towards this development.

now, i don’t want to sound like that stereotypical moviegoer that says, “i guessed the twist before its revelation, hence it all sucks”. like i insinuate above, i was still wholly captivated during the entirety of the third act. nevertheless, fight club’s runtime is far from being short, and fincher spends a lot of time building up an idea that loses its surprise factor even before the film’s midpoint. it changes the protagonist’s perspective, it takes the viewer through a predictable yet entertaining path, setting up a powerful, meaningful ending. however, personally, i don’t feel like the time spent in the first two acts was satisfyingly compensated in the end… at least, not in its entirety.

the second act also has a short period where it loses a bit of steam due to some repetitive sequences and an unnecessary amount of flashbacks. again, i feel like fincher didn’t completely trust the audience back then, contrary to his procedure in se7en. in the latter flick, fincher left the biggest responsibility to the viewer’s imagination, leaving the murder scenes for the audience to picture in their minds. in fight club, that ambiguity and implicit dialogue are still present, sure, but even before the third act, there’s already an attempt to explain too much certain portions of the narrative that i wish would stay vaguer.

without spoiling anything, of course, there’s a vital plot twist that comes later in the movie that i could only appreciate by its execution, but never by its impact on the narrative. jim uhls’ screenplay relies on the main characters’ friendship to carry the story forward, and throughout the first two acts, fincher leaves not-that-subtle hints to a massive revelation, which eventually triggers the beginning of the third act. this major plot point is brilliantly executed, and i still feel incredibly fascinated by its delivery, both in terms of the dialogue and the performances. however, its impact on any lightly focused, observant viewer is close to zero due to the clear evidence that pointed towards this development.

now, i don’t want to sound like that stereotypical moviegoer that says, “i guessed the twist before its revelation, hence it all sucks”. like i insinuate above, i was still wholly captivated during the entirety of the third act. nevertheless, fight club’s runtime is far from being short, and fincher spends a lot of time building up an idea that loses its surprise factor even before the film’s midpoint. it changes the protagonist’s perspective, it takes the viewer through a predictable yet entertaining path, setting up a powerful, meaningful ending. however, personally, i don’t feel like the time spent in the first two acts was satisfyingly compensated in the end… at least, not in its entirety.

the second act also has a short period where it loses a bit of steam due to some repetitive sequences and an unnecessary amount of flashbacks. again, i feel like fincher didn’t completely trust the audience back then, contrary to his procedure in se7en. in the latter flick, fincher left the biggest responsibility to the viewer’s imagination, leaving the murder scenes for the audience to picture in their minds. in fight club, that ambiguity and implicit dialogue are still present, sure, but even before the third act, there’s already an attempt to explain too much certain portions of the narrative that i wish would stay vaguer.

don’t worry, i’m done with the negatives, and don’t forget: i really, really like this movie. obviously, fincher and uhls created a story packed with underlying themes and social commentary. from the whole consumerism theory to the more psychological component regarding edward norton’s mental state, every message is seamlessly communicated to the audience. i’ve also been through a point in my life where i wish i’d be someone else, someone who had already achieved every dream of mine successfully with an overwhelming feeling of fulfillment. coping with the inability to become that perfect someone can become an excruciating, sad, depressing process, and it varies drastically from person to person.

fight club approaches mental health and people’s acceptance of who they truly are in a groundbreaking manner, capturing edward norton’s emotions perfectly and broadcasting his thoughts through some of the best narration in the history of cinema. its take on the world of consumerism is undoubtedly interesting and plays a big part in the climax of the film. despite the issues described above, uhls’ screenplay is very well-written, elevating the conversations between norton and brad pitt (ad astra, once upon a time in hollywood), which are indeed remarkably entertaining. predictable or not, the main story is wonderfully executed by fincher, who continues to demonstrate his impressive technical attributes.

once again, the pre-production phase is proved here to be as important as any other stage in the filmmaking process. fincher’s dedication to his features is palpable and visible on-screen through every single technical aspect. this time, fincher brought in jeff cronenweth as the director of photography, and both worked together to not only create that desaturated, realistic atmosphere that fincher loves so much but also to deliver the brutal, violent, bloody fight scenes that keep the entertainment levels at their highest. with clean, consistent, coherent editing from james haygood, the movie flows beautifully despite its lengthy runtime. the dust brothers’ score is quite alternative, which suits the also unconventional storytelling.

last but not least, edward norton and brad pitt. i know it’s incredibly cliche to write that two actors share impeccable chemistry, but norton and pitt take it to a whole other level. in two physically-demanding displays, both actors deliver award-worthy performances that marked their careers. pitt offers one of his most underrated portrayals, being extremely funny throughout the entire film, but also astonishingly badass, carrying his fight sequences as amazing as he does with his dialogues. on the other hand, seeing norton go all-out is a terrific experience. i lack words to describe such an emotionally compelling interpretation, filled with powerful character moments. a final word of praise to helena bonham carter (enola holmes), who also delivers an exceptional performance.

in the end, fight club is and will probably remain david fincher’s most controversial movie for a long, long time. with an absolutely brilliant direction and execution, fincher uses jim uhls’ captivating, layered, unconventional screenplay to tackle themes such as consumerism, society’s behavior, and mental health, seamlessly transmitting meaningful yet contentious messages. once again, the filmmaking in display is technically flawless, going from the trademark authentic cinematography and production design to the unique score, all flowing superbly through excellent editing. unfortunately, i don’t belong to the group of people who utterly love this film. the excessive (sometimes unnecessary) use of flashbacks doesn’t help, but it’s the enormous build-up packed with overly explicit clues to a significant (yet unsurprising) plot twist that ends up partially ruining the viewing for me. i also wish that the script developed a few plot points more ambiguously, but brad pitt and edward norton elevate the whole movie so much with their ridiculously outstanding performances that these small issues don’t keep me away from highly recommending one of the most memorable, iconic films of all-time.

rating: a-","['enjoy', 'read', 'spoilerfree', 'review', 'please', 'follow', 'blog', '@', '\r\n', 'https://www.msbreviews.com', '\r\n\r\n', 'david', 'fincher', '’s', 'new', 'film', ',', 'mank', ',', 'come', 'soon', 'netflix', ',', 'release', 'six', 'year', 'late', 'installment', ',', 'go', 'girl', '.', 'therefore', ',', 'week', '’m', 'review', 'five', 'fincher', '’s', 'movie', '.', 'se7en', 'first', 'one', ',', '’', 'time', 'one', 'culturally', 'impactful', 'film', '90', ',', 'fight', 'club', '.', 'another', 'rewatch', 'another', 'filmmake', 'classic', ',', 'one', 'never', 'able', 'absolutely', 'adore', 'like', 'people', '.', 'movie', 'come', '1999', ',', 'critic', 'extremely', 'divided', ',', 'film', 'fail', 'box', 'office', '.', 'time', ',', 'gain', 'cult', 'follow', 'home', 'medium', ',', '’s', 'still', 'consider', 'controversial', 'piece', 'cinema', '.', ',', 'nothing', 'new', ',', 'mind', 'fincher', 'helm', '.', '\r\n\r\n', 'despite', 'third', 'fourth', 'time', 'experience', 'story', ',', 'never', 'really', 'change', 'opinion', ',', 'bit', 'uncommon', 'view', 'history', '.', 'usually', ',', 'multiple', 'rewatche', ',', 'overall', 'thought', 'movie', 'slightly', 'vary', ',', 'fight', 'club', 'one', 'exception', '.', 'believe', 'opinion', 'remain', 'intact', 'first', 'watch', '.', 'really', 'enjoy', 'film', ',', 'can', 'not', 'state', 'absolutely', 'love', '.', 'since', 'special', 'case', ',', '’m', 'go', 'start', 'still', 'bother', 'many', 'viewing', ',', 'something', 'also', 'rarely', 'review', 'since', 'always', 'leave', 'bad', 'stuff', 'end', 'article', '.', '\r\n\r\n', 'without', 'spoil', 'anything', ',', 'course', ',', '’', 'vital', 'plot', 'twist', 'come', 'later', 'movie', 'could', 'appreciate', 'execution', ',', 'never', 'impact', 'narrative', '.', 'jim', 'uhls', ""'"", 'screenplay', 'rely', 'main', 'character', '’', 'friendship', 'carry', 'story', 'forward', ',', 'throughout', 'first', 'two', 'act', ',', 'fincher', 'leave', '-', '-', 'subtle', 'hint', 'massive', 'revelation', ',', 'eventually', 'trigger', 'beginning', 'third', 'act', '.', 'major', 'plot', 'point', 'brilliantly', 'execute', ',', 'still', 'feel', 'incredibly', 'fascinated', 'delivery', ',', 'term', 'dialogue', 'performance', '.', 'however', ',', 'impact', 'lightly', 'focused', ',', 'observant', 'viewer', 'close', 'zero', 'due', 'clear', 'evidence', 'point', 'towards', 'development', '.', '\r\n\r\n', ',', 'not', 'want', 'sound', 'like', 'stereotypical', 'moviegoer', 'say', ',', '""', 'guess', 'twist', 'revelation', ',', 'hence', 'suck', '""', '.', 'like', 'insinuate', ',', 'still', 'wholly', 'captivate', 'entirety', 'third', 'act', '.', 'nevertheless', ',', 'fight', 'club', '’s', 'runtime', 'far', 'short', ',', 'fincher', 'spend', 'lot', 'time', 'build', 'idea', 'lose', 'surprise', 'factor', 'even', 'film', '’s', 'midpoint', '.', 'change', 'protagonist', '’s', 'perspective', ',', 'take', 'viewer', 'predictable', 'yet', 'entertaining', 'path', ',', 'set', 'powerful', ',', 'meaningful', 'ending', '.', 'however', ',', 'personally', ',', 'not', 'feel', 'like', 'time', 'spend', 'first', 'two', 'act', 'satisfyingly', 'compensate', 'end', '…', 'least', ',', 'entirety', '.', '\r\n\r\n', 'second', 'act', 'also', 'short', 'period', 'lose', 'bit', 'steam', 'due', 'repetitive', 'sequence', 'unnecessary', 'amount', 'flashback', '.', ',', 'feel', 'like', 'fincher', 'not', 'completely', 'trust', 'audience', 'back', ',', 'contrary', 'procedure', 'se7en', '.', 'latter', 'flick', ',', 'fincher', 'leave', 'big', 'responsibility', 'viewer', '’s', 'imagination', ',', 'leave', 'murder', 'scene', 'audience', 'picture', 'mind', '.', 'fight', 'club', ',', 'ambiguity', 'implicit', 'dialogue', 'still', 'present', ',', 'sure', ',', 'even', 'third', 'act', ',', '’', 'already', 'attempt', 'explain', 'much', 'certain', 'portion', 'narrative', 'wish', 'would', 'stay', 'vaguer', '.', '\r\n\r\n', 'without', 'spoil', 'anything', ',', 'course', ',', '’', 'vital', 'plot', 'twist', 'come', 'later', 'movie', 'could', 'appreciate', 'execution', ',', 'never', 'impact', 'narrative', '.', 'jim', 'uhls', ""'"", 'screenplay', 'rely', 'main', 'character', '’', 'friendship', 'carry', 'story', 'forward', ',', 'throughout', 'first', 'two', 'act', ',', 'fincher', 'leave', '-', '-', 'subtle', 'hint', 'massive', 'revelation', ',', 'eventually', 'trigger', 'beginning', 'third', 'act', '.', 'major', 'plot', 'point', 'brilliantly', 'execute', ',', 'still', 'feel', 'incredibly', 'fascinated', 'delivery', ',', 'term', 'dialogue', 'performance', '.', 'however', ',', 'impact', 'lightly', 'focused', ',', 'observant', 'viewer', 'close', 'zero', 'due', 'clear', 'evidence', 'point', 'towards', 'development', '.', '\r\n\r\n', ',', 'not', 'want', 'sound', 'like', 'stereotypical', 'moviegoer', 'say', ',', '""', 'guess', 'twist', 'revelation', ',', 'hence', 'suck', '""', '.', 'like', 'insinuate', ',', 'still', 'wholly', 'captivate', 'entirety', 'third', 'act', '.', 'nevertheless', ',', 'fight', 'club', '’s', 'runtime', 'far', 'short', ',', 'fincher', 'spend', 'lot', 'time', 'build', 'idea', 'lose', 'surprise', 'factor', 'even', 'film', '’s', 'midpoint', '.', 'change', 'protagonist', '’s', 'perspective', ',', 'take', 'viewer', 'predictable', 'yet', 'entertaining', 'path', ',', 'set', 'powerful', ',', 'meaningful', 'ending', '.', 'however', ',', 'personally', ',', 'not', 'feel', 'like', 'time', 'spend', 'first', 'two', 'act', 'satisfyingly', 'compensate', 'end', '…', 'least', ',', 'entirety', '.', '\r\n\r\n', 'second', 'act', 'also', 'short', 'period', 'lose', 'bit', 'steam', 'due', 'repetitive', 'sequence', 'unnecessary', 'amount', 'flashback', '.', ',', 'feel', 'like', 'fincher', 'not', 'completely', 'trust', 'audience', 'back', ',', 'contrary', 'procedure', 'se7en', '.', 'latter', 'flick', ',', 'fincher', 'leave', 'big', 'responsibility', 'viewer', '’s', 'imagination', ',', 'leave', 'murder', 'scene', 'audience', 'picture', 'mind', '.', 'fight', 'club', ',', 'ambiguity', 'implicit', 'dialogue', 'still', 'present', ',', 'sure', ',', 'even', 'third', 'act', ',', '’', 'already', 'attempt', 'explain', 'much', 'certain', 'portion', 'narrative', 'wish', 'would', 'stay', 'vaguer', '.', '\r\n\r\n', 'not', 'worry', ',', '’m', 'do', 'negative', ',', 'not', 'forget', ':', 'really', ',', 'really', 'like', 'movie', '.', 'obviously', ',', 'fincher', 'uhls', 'create', 'story', 'pack', 'underlie', 'theme', 'social', 'commentary', '.', 'whole', 'consumerism', 'theory', 'psychological', 'component', 'regard', 'edward', 'norton', '’s', 'mental', 'state', ',', 'every', 'message', 'seamlessly', 'communicate', 'audience', '.', '’ve', 'also', 'point', 'life', 'wish', '’d', 'someone', 'else', ',', 'someone', 'already', 'achieve', 'every', 'dream', 'mine', 'successfully', 'overwhelming', 'feeling', 'fulfillment', '.', 'cope', 'inability', 'become', 'perfect', 'someone', 'become', 'excruciating', ',', 'sad', ',', 'depressing', 'process', ',', 'vary', 'drastically', 'person', 'person', '.', '\r\n\r\n', 'fight', 'club', 'approach', 'mental', 'health', 'people', '’s', 'acceptance', 'truly', 'groundbreaking', 'manner', ',', 'capture', 'edward', 'norton', '’s', 'emotion', 'perfectly', 'broadcast', 'thought', 'good', 'narration', 'history', 'cinema', '.', 'take', 'world', 'consumerism', 'undoubtedly', 'interesting', 'play', 'big', 'part', 'climax', 'film', '.', 'despite', 'issue', 'describe', ',', 'uhls', ""'"", 'screenplay', 'well', '-', 'write', ',', 'elevate', 'conversation', 'norton', 'brad', 'pitt', '(', 'ad', 'astra', ',', 'upon', 'time', 'hollywood', ')', ',', 'indeed', 'remarkably', 'entertaining', '.', 'predictable', ',', 'main', 'story', 'wonderfully', 'execute', 'fincher', ',', 'continue', 'demonstrate', 'impressive', 'technical', 'attribute', '.', '\r\n\r\n', ',', 'pre', '-', 'production', 'phase', 'prove', 'important', 'stage', 'filmmaking', 'process', '.', 'fincher', '’s', 'dedication', 'feature', 'palpable', 'visible', '-', 'screen', 'every', 'single', 'technical', 'aspect', '.', 'time', ',', 'fincher', 'bring', 'jeff', 'cronenweth', 'director', 'photography', ',', 'work', 'together', 'create', 'desaturate', ',', 'realistic', 'atmosphere', 'fincher', 'love', 'much', 'also', 'deliver', 'brutal', ',', 'violent', ',', 'bloody', 'fight', 'scene', 'keep', 'entertainment', 'level', 'high', '.', 'clean', ',', 'consistent', ',', 'coherent', 'editing', 'james', 'haygood', ',', 'movie', 'flow', 'beautifully', 'despite', 'lengthy', 'runtime', '.', 'dust', 'brother', ""'"", 'score', 'quite', 'alternative', ',', 'suit', 'also', 'unconventional', 'storytelling', '.', '\r\n\r\n', 'last', 'least', ',', 'edward', 'norton', 'brad', 'pitt', '.', 'know', '’', 'incredibly', 'cliche', 'write', 'two', 'actor', 'share', 'impeccable', 'chemistry', ',', 'norton', 'pitt', 'take', 'whole', 'level', '.', 'two', 'physically', '-', 'demand', 'display', ',', 'actor', 'deliver', 'award', '-', 'worthy', 'performance', 'mark', 'career', '.', 'pitt', 'offer', 'one', 'underrated', 'portrayal', ',', 'extremely', 'funny', 'throughout', 'entire', 'film', ',', 'also', 'astonishingly', 'badass', ',', 'carry', 'fight', 'sequence', 'amazing', 'dialogue', '.', 'hand', ',', 'see', 'norton', 'go', '-', 'terrific', 'experience', '.', 'lack', 'word', 'describe', 'emotionally', 'compelling', 'interpretation', ',', 'fill', 'powerful', 'character', 'moment', '.', 'final', 'word', 'praise', 'helena', 'bonham', 'carter', '(', 'enola', 'holmes', ')', ',', 'also', 'deliver', 'exceptional', 'performance', '.', '\r\n\r\n', 'end', ',', 'fight', 'club', 'probably', 'remain', 'david', 'fincher', '’s', 'controversial', 'movie', 'long', ',', 'long', 'time', '.', 'absolutely', 'brilliant', 'direction', 'execution', ',', 'fincher', 'use', 'jim', 'uhls', ""'"", 'captivating', ',', 'layered', ',', 'unconventional', 'screenplay', 'tackle', 'theme', 'consumerism', ',', 'society', '’s', 'behavior', ',', 'mental', 'health', ',', 'seamlessly', 'transmit', 'meaningful', 'yet', 'contentious', 'message', '.', ',', 'filmmake', 'display', 'technically', 'flawless', ',', 'go', 'trademark', 'authentic', 'cinematography', 'production', 'design', 'unique', 'score', ',', 'flow', 'superbly', 'excellent', 'editing', '.', 'unfortunately', ',', 'not', 'belong', 'group', 'people', 'utterly', 'love', 'film', '.', 'excessive', '(', 'sometimes', 'unnecessary', ')', 'use', 'flashback', 'n’t', 'help', ',', '’', 'enormous', 'build', '-', 'pack', 'overly', 'explicit', 'clue', 'significant', '(', 'yet', 'unsurprising', ')', 'plot', 'twist', 'end', 'partially', 'ruin', 'viewing', '.', 'also', 'wish', 'script', 'develop', 'plot', 'point', 'ambiguously', ',', 'brad', 'pitt', 'edward', 'norton', 'elevate', 'whole', 'movie', 'much', 'ridiculously', 'outstanding', 'performance', 'small', 'issue', 'not', 'keep', 'away', 'highly', 'recommend', 'one', 'memorable', ',', 'iconic', 'film', '-', 'time', '.', '\r\n\r\n', 'rating', ':', 'a-']",
